{
  "session_id": "run-2025-10-22-so-a",
  "issued_at": "2025-10-22T21:00:00Z",
  "state": "stable",
  "cycle": 3,
  "checks": {
    "open_requests": true,
    "plot_invariants": true,
    "world_integrity": true,
    "section_coverage": true,
    "continuity": true,
    "compiler": true,
    "pacing": true,
    "research_pass": true
  },
  "claims_unresolved": 0,
  "metrics": {
    "beats_total": 22,
    "setups": 9,
    "payoffs": 9,
    "unpaired_setups": 0,
    "unpaired_payoffs": 0,
    "wordcount": 20110,
    "art_ratio": 0.19
  },
  "notes": "All invariants met within cycle budget; cosmetic notes deferred.",
  "version": "1.0.0"
}
